question,text_id,chapter,title,section
How do you handle it when you don't hear back from the interviewer after a reasonable amount of time has passed?,22eb7b9b30,CHAPTER 9,Post-Interview and Follow-up,Post-Interview Steps
How do you handle it when you encounter a new scenario during an interview that you haven't practiced before?,22eb7b9b30,CHAPTER 9,Post-Interview and Follow-up,Post-Interview Steps
"Can you share a time when you had to follow up with an interviewer after an interview, and how did you approach the follow-up email?",22eb7b9b30,CHAPTER 9,Post-Interview and Follow-up,Post-Interview Steps
What is your strategy for optimizing your job search by taking notes after each interview?,22eb7b9b30,CHAPTER 9,Post-Interview and Follow-up,Post-Interview Steps
"How do you ensure that your contributions to a project or team are valued and recognized, especially during the early stages of your ML career?",2ca59d8bf2,CHAPTER 9,Post-Interview and Follow-up,First 30/60/90 Days of Your New ML Job
"Can you share an experience where you had to navigate a complex product or project as a new hire in an ML role, and how did you approach it?",2ca59d8bf2,CHAPTER 9,Post-Interview and Follow-up,First 30/60/90 Days of Your New ML Job
"How important is it for data scientists to stay up-to-date with the latest technologies and trends in the field, and how can they go about doing so?",2ca59d8bf2,CHAPTER 9,Post-Interview and Follow-up,First 30/60/90 Days of Your New ML Job
"What are some common mistakes new data scientists make during the onboarding process, and how can they be avoided?",2ca59d8bf2,CHAPTER 9,Post-Interview and Follow-up,First 30/60/90 Days of Your New ML Job
"Are there any additional benefits included in the offer, such as health and dental insurance, maternity and parental leave, or other forms of support?",dee0126444,CHAPTER 9,Post-Interview and Follow-up,Steps of the Offer Stage
"How much is the employer matching contribution to a retirement fund, and how often does it occur?",dee0126444,CHAPTER 9,Post-Interview and Follow-up,Steps of the Offer Stage
"Can you clarify the value of other forms of compensation included in the offer, such as year-end bonuses or profit sharing?",dee0126444,CHAPTER 9,Post-Interview and Follow-up,Steps of the Offer Stage
"Are there any blackout periods for selling restricted stock units (RSUs) in the offer, and how long do they last?",dee0126444,CHAPTER 9,Post-Interview and Follow-up,Steps of the Offer Stage
"What is the vesting period for stocks or options in the offer, and how do you exercise options?",dee0126444,CHAPTER 9,Post-Interview and Follow-up,Steps of the Offer Stage
How do you prioritize your applications and interview preparation when there are multiple opportunities available?,1026686599,CHAPTER 9,Post-Interview and Follow-up,What to Do Between Interviews
"How do you stay motivated and positive during the job search process, especially when facing multiple rejections?",1026686599,CHAPTER 9,Post-Interview and Follow-up,What to Do Between Interviews
"Can you share an instance where you tailored your resume to a specific ML role, and how did that impact the number of interviews you received?",1026686599,CHAPTER 9,Post-Interview and Follow-up,What to Do Between Interviews
What is your approach to networking and building relationships with potential employers and industry professionals?,1026686599,CHAPTER 9,Post-Interview and Follow-up,What to Do Between Interviews
How do you handle rejection during the job search process?,1026686599,CHAPTER 9,Post-Interview and Follow-up,What to Do Between Interviews
"Can you share an example of a thank-you note you sent after an interview, and how did you tailor it to the specific role and company?",22eb7b9b30,CHAPTER 9,Post-Interview and Follow-up,Post-Interview Steps
"What advice would you give to someone just starting out in their ML career, and what are some key areas they should focus on to be successful in the long term?",2ca59d8bf2,CHAPTER 9,Post-Interview and Follow-up,First 30/60/90 Days of Your New ML Job
