question,text_id,chapter,title,section
How do you evaluate the performance of a machine learning model?,86fd49a66d,CHAPTER 1,Machine Learning Roles and the Interview Process,Overview of This Book
What is your approach to handling missing data in a dataset?,86fd49a66d,CHAPTER 1,Machine Learning Roles and the Interview Process,Overview of This Book
Can you explain the difference between supervised and unsupervised learning?,86fd49a66d,CHAPTER 1,Machine Learning Roles and the Interview Process,Overview of This Book
How do you ensure interpretability of a complex machine learning model?,86fd49a66d,CHAPTER 1,Machine Learning Roles and the Interview Process,Overview of This Book
Can you describe your experience with distributed computing technologies like Hadoop or Spark?,86fd49a66d,CHAPTER 1,Machine Learning Roles and the Interview Process,Overview of This Book
How have advances in distributed and parallel computing impacted the availability and accessibility of large datasets for machine learning research?,9a2356679c,CHAPTER 1,Machine Learning Roles and the Interview Process,A Brief History of Machine Learning and Data Science Job Titles
"What are some common job titles in the field of machine learning, and how have they evolved over time?",9a2356679c,CHAPTER 1,Machine Learning Roles and the Interview Process,A Brief History of Machine Learning and Data Science Job Titles
How has the increasing recognition of machine learning and related topics from the broader population affected the job market for these roles?,9a2356679c,CHAPTER 1,Machine Learning Roles and the Interview Process,A Brief History of Machine Learning and Data Science Job Titles
"Can you describe a specific example of how a generative AI model, such as ChatGPT, was able to perform a task that was previously thought to be the exclusive domain of humans?",9a2356679c,CHAPTER 1,Machine Learning Roles and the Interview Process,A Brief History of Machine Learning and Data Science Job Titles
How have advances in Kubernetes and other ML infrastructure tools affected the creation of new job titles and roles within the field of machine learning?,9a2356679c,CHAPTER 1,Machine Learning Roles and the Interview Process,A Brief History of Machine Learning and Data Science Job Titles
How do you handle data preprocessing and feature engineering for machine learning models?,6d22154063,CHAPTER 1,Machine Learning Roles and the Interview Process,Job Titles Requiring ML Experience
"Can you explain the difference between supervised, unsupervised, and reinforcement learning?",6d22154063,CHAPTER 1,Machine Learning Roles and the Interview Process,Job Titles Requiring ML Experience
How do you approach model selection and evaluation for a given problem?,6d22154063,CHAPTER 1,Machine Learning Roles and the Interview Process,Job Titles Requiring ML Experience
Can you walk me through your experience with data visualization tools and techniques?,6d22154063,CHAPTER 1,Machine Learning Roles and the Interview Process,Job Titles Requiring ML Experience
How do you stay up-to-date with the latest developments in machine learning and related fields?,6d22154063,CHAPTER 1,Machine Learning Roles and the Interview Process,Job Titles Requiring ML Experience
What are some common challenges you face when building data pipelines for analytics and ML? How do you overcome them?,61153e0cc4,CHAPTER 1,Machine Learning Roles and the Interview Process,Machine Learning Lifecycle
Can you walk me through your approach to feature engineering in ML development? What are some key considerations?,61153e0cc4,CHAPTER 1,Machine Learning Roles and the Interview Process,Machine Learning Lifecycle
How do you ensure the quality of the data used for ML model training? What metrics or techniques do you use?,61153e0cc4,CHAPTER 1,Machine Learning Roles and the Interview Process,Machine Learning Lifecycle
In what scenarios might you need to iterate back to step B in the machine learning lifecycle? How do you handle these iterations?,61153e0cc4,CHAPTER 1,Machine Learning Roles and the Interview Process,Machine Learning Lifecycle
Can you describe a time when you had to monitor and maintain ML models after deployment? What tools or techniques did you use?,61153e0cc4,CHAPTER 1,Machine Learning Roles and the Interview Process,Machine Learning Lifecycle
How do you determine suitable data sources for machine learning models? What factors do you consider?,535fe561d2,CHAPTER 1,Machine Learning Roles and the Interview Process,The Three Pillars of Machine Learning Roles
"Can you describe a time when you encountered a difficult ML problem, and how did you approach it?",535fe561d2,CHAPTER 1,Machine Learning Roles and the Interview Process,The Three Pillars of Machine Learning Roles
In what ways do you ensure that your ML models are interpretable and explainable to non-technical stakeholders?,535fe561d2,CHAPTER 1,Machine Learning Roles and the Interview Process,The Three Pillars of Machine Learning Roles
How do you balance the trade-offs between model accuracy and deployment time in real-world ML projects?,535fe561d2,CHAPTER 1,Machine Learning Roles and the Interview Process,The Three Pillars of Machine Learning Roles
"Can you walk me through a project where you had to collaborate with cross-functional teams, and how did you handle any communication or project management challenges that arose?",535fe561d2,CHAPTER 1,Machine Learning Roles and the Interview Process,The Three Pillars of Machine Learning Roles
"How do you identify the most important skills for a machine learning role, and how do you prioritize them?",f0d1a5d7be,CHAPTER 1,Machine Learning Roles and the Interview Process,Machine Learning Skills Matrix
"Can you explain the difference between ML development, ML hypothesis testing/monitoring, and reports/dashboards in the context of job titles?",f0d1a5d7be,CHAPTER 1,Machine Learning Roles and the Interview Process,Machine Learning Skills Matrix
"How do you map a job title to the different stages of the ML lifecycle, and what factors do you consider when making this mapping?",f0d1a5d7be,CHAPTER 1,Machine Learning Roles and the Interview Process,Machine Learning Skills Matrix
"What are some common challenges you face when applying for machine learning roles, and how do you overcome them?",f0d1a5d7be,CHAPTER 1,Machine Learning Roles and the Interview Process,Machine Learning Skills Matrix
"Can you walk me through your process for learning new skills and technologies in a short period of time, and how do you determine which ones to focus on?",f0d1a5d7be,CHAPTER 1,Machine Learning Roles and the Interview Process,Machine Learning Skills Matrix
How do you handle missing data in a machine learning model?,6e80eb677b,CHAPTER 1,Machine Learning Roles and the Interview Process,Introduction to ML Job Interviews
Can you explain the difference between supervised and unsupervised learning?,6e80eb677b,CHAPTER 1,Machine Learning Roles and the Interview Process,Introduction to ML Job Interviews
How would you approach a project involving natural language processing?,6e80eb677b,CHAPTER 1,Machine Learning Roles and the Interview Process,Introduction to ML Job Interviews
What is your understanding of cross-validation in machine learning?,6e80eb677b,CHAPTER 1,Machine Learning Roles and the Interview Process,Introduction to ML Job Interviews
How do you ensure that a model is interpretable and explainable to stakeholders?,6e80eb677b,CHAPTER 1,Machine Learning Roles and the Interview Process,Introduction to ML Job Interviews
Can you tell me about a time when you had to troubleshoot an issue with a machine learning model? How did you approach the problem and what was the outcome?,2337809957,CHAPTER 1,Machine Learning Roles and the Interview Process,Machine Learning Job-Interview Process
How do you handle missing or erroneous data in a dataset? Can you walk me through your process for dealing with these issues?,2337809957,CHAPTER 1,Machine Learning Roles and the Interview Process,Machine Learning Job-Interview Process
How do you stay current with developments in the field of machine learning? Can you give an example of a recent paper or article that you found particularly interesting and why?,2337809957,CHAPTER 1,Machine Learning Roles and the Interview Process,Machine Learning Job-Interview Process
"Can you describe a project where you had to work closely with cross-functional teams (e.g., data scientists, engineers, product managers)? How did you ensure effective communication and collaboration throughout the project?",2337809957,CHAPTER 1,Machine Learning Roles and the Interview Process,Machine Learning Job-Interview Process
Have you ever had to make a presentation or pitch to a non-technical audience about a machine learning project? Can you walk me through your approach for distilling complex technical concepts into easily digestible information for a layperson?,2337809957,CHAPTER 1,Machine Learning Roles and the Interview Process,Machine Learning Job-Interview Process
How do you optimize your resume and application materials for machine learning job applications?,e3868ef048,CHAPTER 2,Machine Learning Job Application and Resume,Where Are the Jobs?
What are some effective strategies for searching and finding machine learning job listings beyond traditional job boards?,e3868ef048,CHAPTER 2,Machine Learning Job Application and Resume,Where Are the Jobs?
How do you demonstrate your understanding of the field and its current trends in a machine learning job interview?,e3868ef048,CHAPTER 2,Machine Learning Job Application and Resume,Where Are the Jobs?
Can you walk me through your approach to evaluating and selecting the most relevant machine learning algorithms for a particular problem or project?,e3868ef048,CHAPTER 2,Machine Learning Job Application and Resume,Where Are the Jobs?
"How do you stay up-to-date with the latest developments and advancements in the field of machine learning, and how do you apply them in your work?",e3868ef048,CHAPTER 2,Machine Learning Job Application and Resume,Where Are the Jobs?
How do you tailor your resume and cover letter for a data scientist position when applying to job boards?,59be39571f,CHAPTER 2,Machine Learning Job Application and Resume,Applying to Jobs
"What are some common job titles in the field of machine learning, and how do you determine which roles best fit your skills and experience?",59be39571f,CHAPTER 2,Machine Learning Job Application and Resume,Applying to Jobs
"How do you approach interviewing for a data scientist position, and what questions do you expect to be asked?",59be39571f,CHAPTER 2,Machine Learning Job Application and Resume,Applying to Jobs
Can you provide an example of how you would map your skills to a matrix like the one in Figure 1-8?,59be39571f,CHAPTER 2,Machine Learning Job Application and Resume,Applying to Jobs
"How do you determine which job postings to apply for given your experience and skills, and what factors do you consider when deciding whether or not to apply?",59be39571f,CHAPTER 2,Machine Learning Job Application and Resume,Applying to Jobs
How important is it to include keywords from the job description on a resume?,c80e9a7eaf,CHAPTER 2,Machine Learning Job Application and Resume,"Additional Job Application Materials, Credentials, and FAQ"
What are some common mistakes people make when formatting their resumes?,c80e9a7eaf,CHAPTER 2,Machine Learning Job Application and Resume,"Additional Job Application Materials, Credentials, and FAQ"
Can including a profile picture on a resume in North America be beneficial?,c80e9a7eaf,CHAPTER 2,Machine Learning Job Application and Resume,"Additional Job Application Materials, Credentials, and FAQ"
How long should a resume be for industry jobs in North America and other parts of the world?,c80e9a7eaf,CHAPTER 2,Machine Learning Job Application and Resume,"Additional Job Application Materials, Credentials, and FAQ"
Are there any specific sections or formats that are more important than others on a resume when applying to industry jobs?,c80e9a7eaf,CHAPTER 2,Machine Learning Job Application and Resume,"Additional Job Application Materials, Credentials, and FAQ"
"What are some common challenges you face when working with imbalanced datasets, and how do you address them?",072c02694c,CHAPTER 2,Machine Learning Job Application and Resume,Next Steps
"Can you walk me through a time when you had to optimize a complex and slow query in Python or another programming language? How did you approach the problem, and what was the outcome?",072c02694c,CHAPTER 2,Machine Learning Job Application and Resume,Next Steps
How do you stay up-to-date with the latest developments and trends in machine learning theory and algorithms? Can you give an example of a recent paper or article that caught your attention?,072c02694c,CHAPTER 2,Machine Learning Job Application and Resume,Next Steps
"Have you ever worked on a project where you had to integrate machine learning models with other software tools or systems? If so, can you describe the experience and how you overcame any challenges that arose?",072c02694c,CHAPTER 2,Machine Learning Job Application and Resume,Next Steps
How do you approach data visualization and communication in your work as a data scientist? Can you give an example of a particularly effective visualization you've created and what insights it conveyed to stakeholders?,072c02694c,CHAPTER 2,Machine Learning Job Application and Resume,Next Steps
"Can you give an example of a time when you had to communicate complex technical concepts to a non-technical audience, such as a product manager or business leader? How did you approach the communication?",195ee8d52d,CHAPTER 2,Machine Learning Job Application and Resume,Machine Learning Resume Guide
"How do you stay current with the latest developments and advancements in machine learning, and how have you applied them in your work?",195ee8d52d,CHAPTER 2,Machine Learning Job Application and Resume,Machine Learning Resume Guide
Are there any alumni groups or networks from your university that you could tap into for networking opportunities?,114486e1a1,CHAPTER 2,Machine Learning Job Application and Resume,ML Job Application Guide
What are some ways you could give back to the community or volunteer your time to help build connections and visibility within your industry?,114486e1a1,CHAPTER 2,Machine Learning Job Application and Resume,ML Job Application Guide
Can you describe a time when you had to quickly learn a new technical skill or tool to solve a problem or meet a deadline? How did you approach the learning process?,195ee8d52d,CHAPTER 2,Machine Learning Job Application and Resume,Machine Learning Resume Guide
"What experience do you have working with cross-functional teams, and how have you successfully collaborated with different stakeholders in the past?",195ee8d52d,CHAPTER 2,Machine Learning Job Application and Resume,Machine Learning Resume Guide
"How do you approach problem-solving in a machine learning context, and what strategies have you found most effective for success?",195ee8d52d,CHAPTER 2,Machine Learning Job Application and Resume,Machine Learning Resume Guide
What events or conferences are happening in your industry that you could attend?,114486e1a1,CHAPTER 2,Machine Learning Job Application and Resume,ML Job Application Guide
How can you leverage social media to connect with people in your industry? What platforms do you use most frequently?,114486e1a1,CHAPTER 2,Machine Learning Job Application and Resume,ML Job Application Guide
Can you think of anyone you know who works at a company you're interested in? Why not reach out and grab coffee or lunch with them?,114486e1a1,CHAPTER 2,Machine Learning Job Application and Resume,ML Job Application Guide
"How does oversampling work in practice, and what are some potential issues that can arise when using this technique?",d0f8681a67,CHAPTER 3,Technical Interview: Machine Learning Algorithms,Statistical and Foundational Techniques
Can you discuss the advantages and disadvantages of using ensemble methods such as bagging and boosting in ML?,d0f8681a67,CHAPTER 3,Technical Interview: Machine Learning Algorithms,Statistical and Foundational Techniques
Can you walk me through your thought process when approaching a new machine learning problem? What are some key considerations you make when deciding on the appropriate algorithm or technique to use?,331444d407,CHAPTER 3,Technical Interview: Machine Learning Algorithms,Overview of the Machine Learning Algorithms Technical Interview
How do L1 and L2 regularization differ in terms of their impact on the coefficients of a ML model?,d0f8681a67,CHAPTER 3,Technical Interview: Machine Learning Algorithms,Statistical and Foundational Techniques
"What are some techniques that can be used to handle imbalanced datasets in ML, and how do they work?",d0f8681a67,CHAPTER 3,Technical Interview: Machine Learning Algorithms,Statistical and Foundational Techniques
"Can you explain the concept of bias-variance tradeoff in ML, and how does regularization fit into this tradeoff?",d0f8681a67,CHAPTER 3,Technical Interview: Machine Learning Algorithms,Statistical and Foundational Techniques
"Can you explain the difference between stemming and lemmatization in NLP, and provide an example of how each technique works?",a89864b52f,CHAPTER 3,Technical Interview: Machine Learning Algorithms,Natural Language Processing Algorithms
"What are some potential challenges with using pretrained language models for NLP tasks, and how can these challenges be addressed through fine-tuning or additional data?",a89864b52f,CHAPTER 3,Technical Interview: Machine Learning Algorithms,Natural Language Processing Algorithms
"How do you handle domain-specific language or sarcasm in NLP tasks, and what techniques can be used to improve the model's understanding of these concepts?",a89864b52f,CHAPTER 3,Technical Interview: Machine Learning Algorithms,Natural Language Processing Algorithms
"Can you discuss the importance of adaptability in NLP applications, and how it relates to preprocessing and fine-tuning models for specific tasks.",a89864b52f,CHAPTER 3,Technical Interview: Machine Learning Algorithms,Natural Language Processing Algorithms
How do you address data quality issues in recommender systems?,a6426309ff,CHAPTER 3,Technical Interview: Machine Learning Algorithms,Recommender System Algorithms
What are some possible solutions to handle cold start problems in recommender systems?,a6426309ff,CHAPTER 3,Technical Interview: Machine Learning Algorithms,Recommender System Algorithms
Can you explain the difference between explicit and implicit feedback in recommender systems?,a6426309ff,CHAPTER 3,Technical Interview: Machine Learning Algorithms,Recommender System Algorithms
How do you combine oversampling techniques with other methods to handle class imbalance in recommender systems?,a6426309ff,CHAPTER 3,Technical Interview: Machine Learning Algorithms,Recommender System Algorithms
Can you provide examples of when it makes sense to use reinforcement learning or NLP techniques in combination with recommender systems?,a6426309ff,CHAPTER 3,Technical Interview: Machine Learning Algorithms,Recommender System Algorithms
How does the epsilon-greedy policy help balance exploration and exploitation in reinforcement learning?,4ef8a420bc,CHAPTER 3,Technical Interview: Machine Learning Algorithms,Reinforcement Learning Algorithms
What are some common problems that can affect supervised learning? How do they impact the accuracy of the model?,0ce98a8968,CHAPTER 3,Technical Interview: Machine Learning Algorithms,"Supervised, Unsupervised, and Reinforcement Learning"
Can you give an example of when unsupervised learning is more suitable than supervised learning? What are some real-world applications of each type of learning?,0ce98a8968,CHAPTER 3,Technical Interview: Machine Learning Algorithms,"Supervised, Unsupervised, and Reinforcement Learning"
How does data augmentation help improve the robustness of a machine learning model? Can you provide an example of how it can be applied in image recognition tasks?,0ce98a8968,CHAPTER 3,Technical Interview: Machine Learning Algorithms,"Supervised, Unsupervised, and Reinforcement Learning"
How do you handle a situation where there is not enough labeled data for a specific classification task? What are some strategies that you have used to overcome this challenge?,0ce98a8968,CHAPTER 3,Technical Interview: Machine Learning Algorithms,"Supervised, Unsupervised, and Reinforcement Learning"
Can you explain the difference between a receiver operating characteristic (ROC) curve and an area under the ROC (AUC) metric? How do these metrics evaluate the performance of a binary classification model?,0ce98a8968,CHAPTER 3,Technical Interview: Machine Learning Algorithms,"Supervised, Unsupervised, and Reinforcement Learning"
"How do you determine which preprocessing techniques to use for a specific NLP task, and how do you decide when to keep or remove punctuation?",a89864b52f,CHAPTER 3,Technical Interview: Machine Learning Algorithms,Natural Language Processing Algorithms
How do you define and differentiate between supervised and unsupervised learning? Can you provide examples of each?,331444d407,CHAPTER 3,Technical Interview: Machine Learning Algorithms,Overview of the Machine Learning Algorithms Technical Interview
What are some common techniques used in natural language processing (NLP)? How do you apply these techniques in real-world applications?,331444d407,CHAPTER 3,Technical Interview: Machine Learning Algorithms,Overview of the Machine Learning Algorithms Technical Interview
Explain reinforcement learning and how it differs from other machine learning paradigms. Can you give an example of a problem that could benefit from this approach?,331444d407,CHAPTER 3,Technical Interview: Machine Learning Algorithms,Overview of the Machine Learning Algorithms Technical Interview
"Describe your experience with computer vision tasks, such as image classification or object detection. How do you approach these problems, and what algorithms have you found to be most effective?",331444d407,CHAPTER 3,Technical Interview: Machine Learning Algorithms,Overview of the Machine Learning Algorithms Technical Interview
How do you investigate a reward function to ensure that an RL agent is not exploiting perverse behavior?,4ef8a420bc,CHAPTER 3,Technical Interview: Machine Learning Algorithms,Reinforcement Learning Algorithms
How do you ensure that the thumbnails used for movies on Netflix accurately represent the content of the movie?,914e36400a,CHAPTER 3,Technical Interview: Machine Learning Algorithms,Computer Vision Algorithms
"How do you handle class imbalance in image recognition tasks, and what methods have been most effective for you?",914e36400a,CHAPTER 3,Technical Interview: Machine Learning Algorithms,Computer Vision Algorithms
Can you explain the difference between early stopping and regularization in preventing overfitting in neural networks?,914e36400a,CHAPTER 3,Technical Interview: Machine Learning Algorithms,Computer Vision Algorithms
"What are some common techniques used in data augmentation for computer vision tasks, and how do they help improve model performance?",914e36400a,CHAPTER 3,Technical Interview: Machine Learning Algorithms,Computer Vision Algorithms
"Can you discuss the importance of normalization in image recognition tasks, and how it can impact the accuracy of a model?",914e36400a,CHAPTER 3,Technical Interview: Machine Learning Algorithms,Computer Vision Algorithms
"What is the purpose of experience replay in deep Q-networks, and how does it improve training stability?",4ef8a420bc,CHAPTER 3,Technical Interview: Machine Learning Algorithms,Reinforcement Learning Algorithms
Can you explain a scenario where model-based RL might be more feasible than model-free RL?,4ef8a420bc,CHAPTER 3,Technical Interview: Machine Learning Algorithms,Reinforcement Learning Algorithms
"What are some advantages of using model-free RL in real-world applications, and how can it help overcome challenges related to modeling complex environments?",4ef8a420bc,CHAPTER 3,Technical Interview: Machine Learning Algorithms,Reinforcement Learning Algorithms
What techniques do you use to reduce the dimensionality of high-dimensional datasets during preprocessing?,99eacbbf97,CHAPTER 4,Technical Interview: Model Training and Evaluation,Data Preprocessing and Feature Engineering
"How do you handle missing or invalid data during the preprocessing stage, and what strategies do you employ to mitigate its impact on the model's performance?",0720f39c5b-1,CHAPTER 4,Technical Interview: Model Training and Evaluation,Model Evaluation
Can you explain the concept of model drift and how it can affect the accuracy of an ML model over time? How do you address this issue in your projects?,0720f39c5b-1,CHAPTER 4,Technical Interview: Model Training and Evaluation,Model Evaluation
"In what scenarios would you use a baseline model in an ML project, and how do you determine when to switch from a baseline model to a more complex ML model?",0720f39c5b-1,CHAPTER 4,Technical Interview: Model Training and Evaluation,Model Evaluation
"Can you walk me through the process of feature engineering and selection for an ML task, and how do you prioritize which features to include in the model?",0720f39c5b-1,CHAPTER 4,Technical Interview: Model Training and Evaluation,Model Evaluation
"In what situations might using a baseline model or heuristic be more appropriate than using an ML algorithm, and how do you decide?",005a577345,CHAPTER 4,Technical Interview: Model Training and Evaluation,Defining a Machine Learning Problem
How do you handle missing data during feature engineering?,99eacbbf97,CHAPTER 4,Technical Interview: Model Training and Evaluation,Data Preprocessing and Feature Engineering
