question,text_id,chapter,title,section
What are some common regularization techniques used to prevent overfitting in machine learning? Can you explain how they work and what types of models they are typically applied to?,0720f39c5b,CHAPTER 4,Technical Interview: Model Training and Evaluation,The Model Training Process
Can you explain the concept of label encoding and how it's used in ML algorithms?,99eacbbf97,CHAPTER 4,Technical Interview: Model Training and Evaluation,Data Preprocessing and Feature Engineering
How do you ensure that your features are not leaking into the validation or test sets during training?,99eacbbf97,CHAPTER 4,Technical Interview: Model Training and Evaluation,Data Preprocessing and Feature Engineering
"What are some common techniques used for feature selection in ML, and why is it important to perform feature selection before training a model?",99eacbbf97,CHAPTER 4,Technical Interview: Model Training and Evaluation,Data Preprocessing and Feature Engineering
What are some common loss functions used in machine learning? Can you explain their purpose and how they work?,0720f39c5b,CHAPTER 4,Technical Interview: Model Training and Evaluation,The Model Training Process
How do optimizers work to adjust the model's parameters to minimize the loss function? Can you name a few popular optimizers and their characteristics?,0720f39c5b,CHAPTER 4,Technical Interview: Model Training and Evaluation,The Model Training Process
"What is experiment tracking, and why is it important to keep track of hyperparameter-tuning experiments? Can you mention some common tools used for experiment tracking in machine learning?",0720f39c5b,CHAPTER 4,Technical Interview: Model Training and Evaluation,The Model Training Process
How do RL algorithms differ from tree-based methods in terms of their use cases? Can you give an example of a problem where one type of algorithm would be more suitable than the other?,0720f39c5b,CHAPTER 4,Technical Interview: Model Training and Evaluation,The Model Training Process
How do you handle overfitting in model training and evaluation?,005a577345,CHAPTER 4,Technical Interview: Model Training and Evaluation,Defining a Machine Learning Problem
"What techniques do you use to evaluate the performance of an ML model, and how do you determine which one is best for a particular task?",0720f39c5b-1,CHAPTER 4,Technical Interview: Model Training and Evaluation,Model Evaluation
How do you determine when an ML algorithm is good enough for practical use?,005a577345,CHAPTER 4,Technical Interview: Model Training and Evaluation,Defining a Machine Learning Problem
Can you think of any scenarios where using heuristics instead of ML might be more appropriate?,005a577345,CHAPTER 4,Technical Interview: Model Training and Evaluation,Defining a Machine Learning Problem
"What are some common trade-offs between different ML algorithms in different scenarios, and how do you select the best one for a given problem?",005a577345,CHAPTER 4,Technical Interview: Model Training and Evaluation,Defining a Machine Learning Problem
Write a Python brainteaser to reverse a list of numbers without using any built-in reversal functions. Can you solve it in under 10 lines of code?,e5aff76113,CHAPTER 5,Technical Interview: Coding,Starting from Scratch: Learning Roadmap If You Don’t Know Python
"Write a Python function to find the top 3 most frequent items in a list of integers, and return them as a list. How would you optimize this function for large datasets?",e5aff76113,CHAPTER 5,Technical Interview: Coding,Starting from Scratch: Learning Roadmap If You Don’t Know Python
"Given a list of integers, create a Python class that implements a simple bank account with deposit, withdraw, and balance methods. How would you handle errors and edge cases in this implementation?",e5aff76113,CHAPTER 5,Technical Interview: Coding,Starting from Scratch: Learning Roadmap If You Don’t Know Python
What is the most efficient way to find the sum of all pairs of numbers in an array such that the total value of each pair adds up to a given target value? How would you optimize your solution?,16c46692ba,CHAPTER 5,Technical Interview: Coding,Python Coding Interview: Brainteaser Questions
Can you come up with a solution using only one pointer to find two numbers in an array that multiply to a given target value? How would you implement this solution?,16c46692ba,CHAPTER 5,Technical Interview: Coding,Python Coding Interview: Brainteaser Questions
What is the most efficient way to find two numbers in an array that add up to a given target value? How would you optimize your solution?,16c46692ba,CHAPTER 5,Technical Interview: Coding,Python Coding Interview: Brainteaser Questions
"If you were tasked with building a predictive model to forecast the number of clicks on a website based on various factors such as time of day, day of the week, and recent weather patterns, what types of data sources would you consider leveraging beyond just the website's historical click data? Explain your reasoning.",b00775576b,CHAPTER 5,Technical Interview: Coding,Python Coding Interview: Data- and ML-Related Questions
"How do you handle missing values in a dataset, especially when working with machine learning models? Can you walk me through your thought process?",b00775576b,CHAPTER 5,Technical Interview: Coding,Python Coding Interview: Data- and ML-Related Questions
Imagine a scenario where a company wants to predict which customers are most likely to churn within the next 30 days. What types of data and features would you consider critical for building an accurate prediction model? Why?,b00775576b,CHAPTER 5,Technical Interview: Coding,Python Coding Interview: Data- and ML-Related Questions
How would you approach a recommendation system for a new user who has no prior activity or connections on a social media platform? What factors would you consider when designing the model?,b00775576b,CHAPTER 5,Technical Interview: Coding,Python Coding Interview: Data- and ML-Related Questions
Can you explain the difference between a bias and a variance in machine learning? Give an example for each.,b00775576b,CHAPTER 5,Technical Interview: Coding,Python Coding Interview: Data- and ML-Related Questions
"What is the most important factor to consider when taking an on-site interview, and how can candidates prepare for it?",6d7e81991e,CHAPTER 5,Technical Interview: Coding,Coding Interview Success Tips
"How do you ensure that you are in a quiet environment during video calls, and what virtual background options are available on popular video conferencing platforms?",6d7e81991e,CHAPTER 5,Technical Interview: Coding,Coding Interview Success Tips
Can you share any experiences or tips on how to ask for help during an interview without appearing unprepared?,6d7e81991e,CHAPTER 5,Technical Interview: Coding,Coding Interview Success Tips
What advice would you give to candidates regarding how to manage their time during technical interviews?,6d7e81991e,CHAPTER 5,Technical Interview: Coding,Coding Interview Success Tips
"How do you handle it when you are close to solving a problem during an interview, but the interviewer is in a hurry?",6d7e81991e,CHAPTER 5,Technical Interview: Coding,Coding Interview Success Tips
Write a Python function to take a list of strings as input and return the longest common prefix between any two strings in the list. Can you optimize this function for efficiency in large datasets?,e5aff76113,CHAPTER 5,Technical Interview: Coding,Starting from Scratch: Learning Roadmap If You Don’t Know Python
"Given a SQL table with multiple columns, write a Python function to group the data by one column and calculate the average value of another column within each group. How would you handle missing or null values in this calculation?",e5aff76113,CHAPTER 5,Technical Interview: Coding,Starting from Scratch: Learning Roadmap If You Don’t Know Python
Can you come up with a solution using only one pointer to find the maximum number of pairs of numbers in an array such that the total value of each pair is less than or equal to a given target value? How would you implement this solution?,16c46692ba,CHAPTER 5,Technical Interview: Coding,Python Coding Interview: Brainteaser Questions
Write a function to check if a given string is a palindrome. How would you optimize your solution?,dbd8460895,CHAPTER 5,Technical Interview: Coding,Roadmaps for Preparing for Coding Interviews
What is the most efficient way to find two numbers in an array that are as far apart as possible while still adding up to a given target value? How would you optimize your solution?,16c46692ba,CHAPTER 5,Technical Interview: Coding,Python Coding Interview: Brainteaser Questions
"Design a database schema to store information about movies, including titles, directors, genres, and release dates. How would you normalize the data?",ae2aa1ca31,CHAPTER 5,Technical Interview: Coding,SQL Coding Interview: Data-Related Questions
Write a query to find the average rating of all movies released in a particular year. What types of subqueries do you think you might need to use to write this query?,ae2aa1ca31,CHAPTER 5,Technical Interview: Coding,SQL Coding Interview: Data-Related Questions
"Explain the concept of join operations in SQL, using examples from real-world scenarios. How would you optimize a complex join operation for performance?",ae2aa1ca31,CHAPTER 5,Technical Interview: Coding,SQL Coding Interview: Data-Related Questions
Imagine you are working with a dataset containing information about customer purchases at an online retailer. Write a query to find the top 5 products purchased by customers in a specific geographic region. How would you handle missing data or invalid addresses in the dataset?,ae2aa1ca31,CHAPTER 5,Technical Interview: Coding,SQL Coding Interview: Data-Related Questions
"Given two tables, one containing movie titles and the other containing director names, write a query to find all movies directed by a particular director. How would you handle ambiguous or missing information in either table?",ae2aa1ca31,CHAPTER 5,Technical Interview: Coding,SQL Coding Interview: Data-Related Questions
"Given a list of numbers, find the first pair of elements that add up to a given target value. How would you optimize your solution?",dbd8460895,CHAPTER 5,Technical Interview: Coding,Roadmaps for Preparing for Coding Interviews
Write a function to reverse a linked list. How would you optimize your solution?,dbd8460895,CHAPTER 5,Technical Interview: Coding,Roadmaps for Preparing for Coding Interviews
"Given an array of integers, find the maximum subarray that sums to a given target value. How would you optimize your solution?",dbd8460895,CHAPTER 5,Technical Interview: Coding,Roadmaps for Preparing for Coding Interviews
"Given a matrix of integers, find the largest square submatrix that contains all the numbers in the original matrix. How would you optimize your solution?",dbd8460895,CHAPTER 5,Technical Interview: Coding,Roadmaps for Preparing for Coding Interviews
"How do you stay up-to-date with the latest developments in ML deployment technologies and practices, especially those related to on-device or edge deployments? Can you share any resources or communities that you find particularly helpful in staying informed?",f45e93a39b,CHAPTER 6,Technical Interview: Model Deployment and End-to-End ML,Model Deployment
How do you optimize ML model inputs to ensure fast runtime execution for production use cases? Can you provide examples of such optimizations?,f45e93a39b,CHAPTER 6,Technical Interview: Model Deployment and End-to-End ML,Model Deployment
"What are some common bottlenecks that ML engineers face during deployment, and how do you troubleshoot them? Can you share any success stories or lessons learned from your past experiences?",f45e93a39b,CHAPTER 6,Technical Interview: Model Deployment and End-to-End ML,Model Deployment
"How do you approach debugging ML models in production environments, especially when the issue is intermittent or hard to reproduce? What tools or techniques do you find most useful for this purpose?",f45e93a39b,CHAPTER 6,Technical Interview: Model Deployment and End-to-End ML,Model Deployment
"In a large organization with an established CI/CD pipeline, how would you ensure that your ML model updates are properly integrated and deployed without disrupting the existing workflows? Can you walk us through your process for achieving this?",f45e93a39b,CHAPTER 6,Technical Interview: Model Deployment and End-to-End ML,Model Deployment
Can you describe a time when you had to scale an ML model rapidly due to increased traffic? How did you handle it?,9ebc3f2b8d,CHAPTER 6,Technical Interview: Model Deployment and End-to-End ML,Additional Technical Interview Components
"How do you monitor the performance of a production ML application, and what tools do you use?",9ebc3f2b8d,CHAPTER 6,Technical Interview: Model Deployment and End-to-End ML,Additional Technical Interview Components
"In your experience, how have you handled data drift in an ML model over time? What methods have you found most effective?",9ebc3f2b8d,CHAPTER 6,Technical Interview: Model Deployment and End-to-End ML,Additional Technical Interview Components
Can you walk me through a time when you had to integrate an ML model into a larger software system? What challenges did you encounter during the integration process?,9ebc3f2b8d,CHAPTER 6,Technical Interview: Model Deployment and End-to-End ML,Additional Technical Interview Components
"How do you ensure that your ML models are compliant with relevant data privacy regulations, such as GDPR or CCPA? Can you give me an example of a specific strategy you've used in the past to address this issue?",9ebc3f2b8d,CHAPTER 6,Technical Interview: Model Deployment and End-to-End ML,Additional Technical Interview Components
"How do you handle situations where the output of the ML model leads to incorrect results despite high accuracy, and what steps do you take to address it?",2e54c275a1,CHAPTER 6,Technical Interview: Model Deployment and End-to-End ML,Model Monitoring
How do you manage and organize your code and data when working on multiple projects or datasets simultaneously?,95d66e0b67,CHAPTER 6,Technical Interview: Model Deployment and End-to-End ML,Overview of Cloud Providers
"What are some of the key differences between GCP's Cloud Storage and AWS' S3, and how do you choose which one to use in a given scenario?",95d66e0b67,CHAPTER 6,Technical Interview: Model Deployment and End-to-End ML,Overview of Cloud Providers
"Can you describe a time when you had to deploy a machine learning model to a production environment, and what challenges did you encounter during the deployment process? How did you resolve them?",95d66e0b67,CHAPTER 6,Technical Interview: Model Deployment and End-to-End ML,Overview of Cloud Providers
"How do you stay up-to-date with the latest developments and advancements in the field of machine learning, particularly in the context of cloud computing and GCP/AWS?",95d66e0b67,CHAPTER 6,Technical Interview: Model Deployment and End-to-End ML,Overview of Cloud Providers
"Can you walk me through your experience with Cloud SQL, BigQuery, or other Google Cloud databases, and how have you used them in a data science/ML workflow?",95d66e0b67,CHAPTER 6,Technical Interview: Model Deployment and End-to-End ML,Overview of Cloud Providers
"How do you approach learning new software development skills, and how do you apply them to your work?",acad0ef561,CHAPTER 6,Technical Interview: Model Deployment and End-to-End ML,Developer Best Practices for Interviews
Can you walk me through a time when you had to debug a complex issue in your codebase? How did you go about solving it?,acad0ef561,CHAPTER 6,Technical Interview: Model Deployment and End-to-End ML,Developer Best Practices for Interviews
How do you handle code reviews and feedback from team members? Can you give an example of a constructive comment you've received and how you incorporated it into your work?,acad0ef561,CHAPTER 6,Technical Interview: Model Deployment and End-to-End ML,Developer Best Practices for Interviews
"Have you ever used version control for a personal project or school assignment? If so, can you describe the process you went through and any challenges you faced?",acad0ef561,CHAPTER 6,Technical Interview: Model Deployment and End-to-End ML,Developer Best Practices for Interviews
How do you ensure that your code is portable and easy to integrate with other team members' work in a collaborative software development workflow? Can you give an example of a tool or practice you've used to achieve this?,acad0ef561,CHAPTER 6,Technical Interview: Model Deployment and End-to-End ML,Developer Best Practices for Interviews
Can you give an example of how you would investigate a sudden drop in model accuracy without complete feedback loops?,2e54c275a1,CHAPTER 6,Technical Interview: Model Deployment and End-to-End ML,Model Monitoring
How do you monitor accuracy-related metrics for machine learning models in production?,2e54c275a1,CHAPTER 6,Technical Interview: Model Deployment and End-to-End ML,Model Monitoring
What are some common tools used for data quality checks and monitoring in ML?,2e54c275a1,CHAPTER 6,Technical Interview: Model Deployment and End-to-End ML,Model Monitoring
How do you set up automated data checks or unit tests to ensure model performance and accuracy?,2e54c275a1,CHAPTER 6,Technical Interview: Model Deployment and End-to-End ML,Model Monitoring
Give an example of a transferable skill you have from a non-ML field that has helped you in your ML work? How did you apply it?,052c470148,CHAPTER 7,Behavioral Interviews,Behavioral Interview Best Practices
How do you explain technical and nontechnical concepts to an audience with varying levels of familiarity?,f6f741906a,CHAPTER 7,Behavioral Interviews,Behavioral Interview Questions and Responses
What strategies have you used to connect with interviewers who work in different domains or companies?,f6f741906a,CHAPTER 7,Behavioral Interviews,Behavioral Interview Questions and Responses
"How do you provide context for acronyms, technologies, or terms that the interviewer may not be familiar with?",f6f741906a,CHAPTER 7,Behavioral Interviews,Behavioral Interview Questions and Responses
In what situations might you adjust the level of detail when explaining technical concepts during an interview?,f6f741906a,CHAPTER 7,Behavioral Interviews,Behavioral Interview Questions and Responses
Can you give an example of how you provided context for a ML model or technology during an interview?,f6f741906a,CHAPTER 7,Behavioral Interviews,Behavioral Interview Questions and Responses
How do you handle working with someone who has a different communication style than you?,f6620b37bc,CHAPTER 7,Behavioral Interviews,Common Behavioral Questions and Recommendations
Can you describe a time when you had to adapt to a new technology or tool for a project? How did you approach the learning process?,f6620b37bc,CHAPTER 7,Behavioral Interviews,Common Behavioral Questions and Recommendations
Have you ever had to balance competing priorities in a project? How did you manage your time and resources to meet deadlines?,f6620b37bc,CHAPTER 7,Behavioral Interviews,Common Behavioral Questions and Recommendations
Tell me about a time when you had to explain a complex technical concept to a non-technical person. How did you approach the explanation?,f6620b37bc,CHAPTER 7,Behavioral Interviews,Common Behavioral Questions and Recommendations
Can you walk me through how you handle feedback from a colleague or manager? What steps do you take to incorporate their suggestions into your work?,f6620b37bc,CHAPTER 7,Behavioral Interviews,Common Behavioral Questions and Recommendations
Can you describe a time when you had to troubleshoot an issue in your ML project without clear instructions? How did you approach it?,052c470148,CHAPTER 7,Behavioral Interviews,Behavioral Interview Best Practices
"Can you give an instance of a conflict you resolved, and how did you handle it?",322f155e7d,CHAPTER 7,Behavioral Interviews,Specific Preparation Examples for Big Tech
Give an example of a time when you went above and beyond your normal responsibilities. What motivated you?,322f155e7d,CHAPTER 7,Behavioral Interviews,Specific Preparation Examples for Big Tech
Tell me about a time when you made a decision due to curiosity. What was the outcome?,322f155e7d,CHAPTER 7,Behavioral Interviews,Specific Preparation Examples for Big Tech
Can you give an instance of when you had to raise the bar for your team or project? How did you go about it?,322f155e7d,CHAPTER 7,Behavioral Interviews,Specific Preparation Examples for Big Tech
"Can you walk me through the process of building a self-directed ML project from start to finish? What were some of the challenges you faced along the way, and how did you overcome them?",052c470148,CHAPTER 7,Behavioral Interviews,Behavioral Interview Best Practices
Have you ever encountered a difficult technical or behavioral challenge during an interview for an ML position? How did you handle it?,052c470148,CHAPTER 7,Behavioral Interviews,Behavioral Interview Best Practices
"Tell me about a situation where you had to lead a team in completing an ML project. What was your role, and how did you ensure everyone stayed on track?",052c470148,CHAPTER 7,Behavioral Interviews,Behavioral Interview Best Practices
Describe a moment when you had to think creatively to solve a problem. How did you come up with the solution?,322f155e7d,CHAPTER 7,Behavioral Interviews,Specific Preparation Examples for Big Tech
What strategies will you use to stay motivated and focused during the interview preparation process?,995cfd588e,CHAPTER 8,Tying It All Together: Your Interview Roadmap,Interview Roadmap Template
How do you plan to structure your study schedule for data scientist interviews?,995cfd588e,CHAPTER 8,Tying It All Together: Your Interview Roadmap,Interview Roadmap Template
"How long do you plan to prepare for interviews before starting to apply, and what milestones have you set for yourself during that time frame?",e123c4c971,CHAPTER 8,Tying It All Together: Your Interview Roadmap,Interview Preparation Checklist
What steps are you taking to tidy up your resume and make it more relevant to the data scientist position?,e123c4c971,CHAPTER 8,Tying It All Together: Your Interview Roadmap,Interview Preparation Checklist
Can you identify the types of interviews that might be most relevant for the role you're aiming to fill?,e123c4c971,CHAPTER 8,Tying It All Together: Your Interview Roadmap,Interview Preparation Checklist
How do you assess your skills in relation to the requirements for the role you're targeting?,e123c4c971,CHAPTER 8,Tying It All Together: Your Interview Roadmap,Interview Preparation Checklist
What parts of the ML lifecycle are you most interested in working on at work?,e123c4c971,CHAPTER 8,Tying It All Together: Your Interview Roadmap,Interview Preparation Checklist
How will you prioritize your studying topics based on their importance and relevance to the interview?,995cfd588e,CHAPTER 8,Tying It All Together: Your Interview Roadmap,Interview Roadmap Template
How do you assess your knowledge gaps and areas for improvement when preparing for an interview?,6dadcd84bd,CHAPTER 8,Tying It All Together: Your Interview Roadmap,Impostor Syndrome
"Can you describe a time when you had to adjust your plans due to unforeseen circumstances, and how did you handle it?",995cfd588e,CHAPTER 8,Tying It All Together: Your Interview Roadmap,Interview Roadmap Template
"How do you balance your study schedule with other life commitments, such as work or family obligations?",995cfd588e,CHAPTER 8,Tying It All Together: Your Interview Roadmap,Interview Roadmap Template
What methods have you found most helpful for staying accountable and motivated during interview preparation?,561ddf5f64,CHAPTER 8,Tying It All Together: Your Interview Roadmap,Efficient Interview Preparation
"How do you handle moments of stuckness or burnout during your preparation, and what strategies do you find most effective?",561ddf5f64,CHAPTER 8,Tying It All Together: Your Interview Roadmap,Efficient Interview Preparation
"In what ways do you think sharing progress with a friend or mentor can be beneficial for interview preparation, and have you tried this approach before?",561ddf5f64,CHAPTER 8,Tying It All Together: Your Interview Roadmap,Efficient Interview Preparation
How do you incorporate breaks into your Pomodoro Technique sessions to avoid burnout and maintain focus throughout your preparation?,561ddf5f64,CHAPTER 8,Tying It All Together: Your Interview Roadmap,Efficient Interview Preparation
"Have you found that being your own accountability buddy is more or less effective than sharing progress with others, and why do you think that is?",561ddf5f64,CHAPTER 8,Tying It All Together: Your Interview Roadmap,Efficient Interview Preparation
Can you describe a situation where you had to communicate complex technical concepts to a non-technical audience? How did you approach the communication?,6dadcd84bd,CHAPTER 8,Tying It All Together: Your Interview Roadmap,Impostor Syndrome
Can you tell me about a time when you had to learn a new skill or technology quickly for a project? How did you approach the task?,6dadcd84bd,CHAPTER 8,Tying It All Together: Your Interview Roadmap,Impostor Syndrome
"How do you handle impostor syndrome in your career, especially during interviews?",6dadcd84bd,CHAPTER 8,Tying It All Together: Your Interview Roadmap,Impostor Syndrome
How do you ensure that you're providing value to the team and contributing to the project's success during an interview?,6dadcd84bd,CHAPTER 8,Tying It All Together: Your Interview Roadmap,Impostor Syndrome
